number,value,datetime_start,datetime_complete,duration,params_alpha,params_colsample_bylevel,params_colsample_bytree,params_eta,params_gamma,params_grow_policy,params_lambda,params_max_depth,params_min_child_weight,params_subsample,user_attrs_n_estimators,state
0,0.8104236666666668,2021-08-15 18:59:28.771894,2021-08-15 19:01:15.971926,0 days 00:01:47.200032,5.245067284292755e-07,0.3101508282905714,0.8552610585054197,0.0015717105762930892,1.4051804997236836e-06,depthwise,1.918256639782924e-06,5,14.985544953661675,0.6276447411898405,10000,COMPLETE
1,0.6433466666666666,2021-08-15 19:01:15.972403,2021-08-15 19:01:17.909470,0 days 00:00:01.937067,0.07903964989861849,0.9721360291707286,0.7180252846207658,0.0019592131605947667,4.4616339223659546e-08,depthwise,1.1692994783837606e-08,1,6.545543930036399,0.44761073009078534,125,COMPLETE
2,0.8020686666666667,2021-08-15 19:01:17.909900,2021-08-15 19:01:19.841654,0 days 00:00:01.931754,9.02992373454873e-06,0.4896952733075479,0.3075805788514995,0.4228659704069859,0.0008813396475082838,depthwise,2.417603029723942e-05,6,0.4160979285297538,0.9936696113663277,30,COMPLETE
3,0.7826996666666668,2021-08-15 19:01:19.842082,2021-08-15 19:01:22.953547,0 days 00:00:03.111465,3.7740205107650395e-05,0.35714298174051673,0.765990370793515,0.00023900027711729716,0.009337762339824331,lossguide,1.553014121828355e-07,7,12.19153185314416,0.6573561144692698,53,COMPLETE
4,0.7876666666666666,2021-08-15 19:01:22.954009,2021-08-15 19:01:33.671992,0 days 00:00:10.717983,4.309775405330366e-06,0.7904584751084365,0.46835982449498315,1.4934101465508095e-08,0.949070670166211,lossguide,0.0007369358815999715,8,0.07630064806360225,0.2298554097858454,236,COMPLETE
5,0.8069299999999999,2021-08-15 19:01:33.672389,2021-08-15 19:02:15.851404,0 days 00:00:42.179015,4.443364368578757e-05,0.6150287920834715,0.5577960433117433,0.028214720712902857,1.207700147482959e-06,depthwise,6.385925989090009e-07,2,0.018370335113421968,0.881786073260628,5797,COMPLETE
6,0.8109259999999999,2021-08-15 19:02:15.851832,2021-08-15 19:03:07.020909,0 days 00:00:51.169077,8.382824334062592e-06,0.6004268087850522,0.5343269858826794,0.008850019503526502,0.014487982049199743,depthwise,8.133602665041407e-08,9,0.029215108936791072,0.908215492863772,909,COMPLETE
7,0.7052856666666667,2021-08-15 19:03:07.021320,2021-08-15 19:03:08.674580,0 days 00:00:01.653260,1.5273873645882213e-06,0.2217855154080997,0.8698592708653579,4.55646554786114e-06,0.01795117378074511,lossguide,0.0007086330361240398,1,0.049620630433063105,0.41711928447572116,84,COMPLETE
8,0.7897473333333332,2021-08-15 19:03:08.674989,2021-08-15 19:03:43.896582,0 days 00:00:35.221593,7.710758139920401e-06,0.4767369313235241,0.35447712661225284,0.017425958032482092,0.08746813895381388,depthwise,4.49522916293507e-05,1,10.99601617635588,0.5290794049614502,5478,COMPLETE
9,0.6084546666666667,2021-08-15 19:03:43.897016,2021-08-15 19:03:45.073019,0 days 00:00:01.176003,1.8828105031681066e-08,0.9183718891787653,0.6646776524939957,3.8638967605081134e-05,0.12206714959899523,depthwise,2.1055229947341046e-05,1,3.487497034709041,0.8156461205396857,1,COMPLETE
10,0.7788160000000001,2021-08-15 19:03:45.073440,2021-08-15 19:03:49.479485,0 days 00:00:04.406045,0.003988936099628474,0.7338850239385774,0.230807908985383,2.084612072681264e-07,8.245493762884149e-05,lossguide,0.49207892313285007,9,0.26051667721782107,0.796346931008191,24,COMPLETE
11,0.7977293333333333,2021-08-15 19:03:49.479973,2021-08-15 19:03:51.176598,0 days 00:00:01.696625,7.381708522321945e-08,0.2712467817471177,0.9999670669955246,0.7513779819896328,6.593438173704961e-06,depthwise,6.25093613171015e-07,4,1.7135263014744393,0.6854819024307235,47,COMPLETE
12,0.8071043333333333,2021-08-15 19:03:51.177024,2021-08-15 19:05:25.677533,0 days 00:01:34.500509,0.0019267737262660455,0.5896467218228206,0.5301723907178564,0.001619486945323866,2.168708011988186e-08,depthwise,1.2454748938682409e-08,4,0.010013086271443275,0.9575633180821046,10000,COMPLETE
13,0.811252,2021-08-15 19:05:25.677960,2021-08-15 19:05:35.800413,0 days 00:00:10.122453,2.2491786796293384e-07,0.4227337388340742,0.8924227755514116,0.03471167238129003,1.4887746406126163e-06,depthwise,2.4047602768926695e-06,5,1.3099233378198416,0.7209627365273569,778,COMPLETE
14,0.8111449999999999,2021-08-15 19:05:35.800831,2021-08-15 19:05:47.749456,0 days 00:00:11.948625,1.4841338140243242e-07,0.44854923877173725,0.4332010211672187,0.03895911081068174,0.00031183271999378324,depthwise,8.173132489441086e-08,9,1.0059596112114901,0.7685536826974089,246,COMPLETE
15,0.8104036666666666,2021-08-15 19:05:47.749887,2021-08-15 19:05:52.616158,0 days 00:00:04.866271,1.8118712952559902e-07,0.40517146334634235,0.44116570639489333,0.08819232409215541,7.344882487176022e-05,depthwise,3.572716927002894e-06,6,1.3468641459104156,0.7489250642901948,252,COMPLETE
16,0.741254,2021-08-15 19:05:52.616651,2021-08-15 19:05:54.343571,0 days 00:00:01.726920,2.2992579386983143e-08,0.4345227315951648,0.3680632820319063,5.166653038535381e-05,0.0009703309872171701,depthwise,0.03483345190902505,3,0.18855742438808062,0.5425400884788439,59,COMPLETE
17,0.8081863333333335,2021-08-15 19:05:54.344009,2021-08-15 19:05:57.864881,0 days 00:00:03.520872,0.00030973332166470195,0.5282492132554856,0.9755953930487322,0.13237216442352429,1.1823056708340304e-05,depthwise,9.323719769343308e-08,7,0.9452387690899268,0.7463112411249723,78,COMPLETE
18,0.7698473333333333,2021-08-15 19:05:57.865298,2021-08-15 19:06:01.633260,0 days 00:00:03.767962,1.0597696139451571e-08,0.6689114779319603,0.6346585901330404,5.456508999739887e-06,2.0630602692472316e-07,lossguide,0.0002535716916887646,5,0.7000869731492388,0.2174307260713259,197,COMPLETE
19,0.7851306666666668,2021-08-15 19:06:01.633686,2021-08-15 19:06:04.981915,0 days 00:00:03.348229,1.5738687764380236e-07,0.36191930862891974,0.8015088160238876,0.0005193441722663564,0.0008516989596299056,depthwise,0.007805610991414833,7,3.001812042931381,0.3416467660727746,68,COMPLETE
20,0.8106903333333334,2021-08-15 19:06:04.982330,2021-08-15 19:06:48.049822,0 days 00:00:43.067492,0.19627418871324612,0.5412215571370084,0.21134515452724667,0.013100185419022194,1.7983948673090165e-05,depthwise,6.593862071260164e-06,4,0.17011266737850642,0.5487071050477399,4839,COMPLETE
21,0.811067,2021-08-15 19:06:48.050254,2021-08-15 19:07:40.073872,0 days 00:00:52.023618,5.400268008144979e-07,0.6473416790544805,0.4658771382432875,0.007509704807190608,0.002980935670746338,depthwise,9.751191564363267e-08,9,0.053195817271131464,0.9007231941966916,974,COMPLETE
22,0.8057376666666666,2021-08-15 19:07:40.074295,2021-08-15 19:07:44.858650,0 days 00:00:04.784355,7.246695466048322e-07,0.7859286375537251,0.4325715455754622,0.13747887685158885,0.0003228225673354784,depthwise,2.7894332696641587e-07,8,0.09897174657428219,0.8493310305767099,69,COMPLETE
23,0.8119503333333333,2021-08-15 19:07:44.859083,2021-08-15 19:08:52.262516,0 days 00:01:07.403433,9.003648929707625e-08,0.6906998563737434,0.4848584109099578,0.005431443551112918,0.006642272227686745,depthwise,4.040419285171708e-08,8,0.517081080798077,0.7415079740404058,2040,COMPLETE
24,0.8102906666666666,2021-08-15 19:08:52.262953,2021-08-15 19:09:00.422935,0 days 00:00:08.159982,6.973133317674033e-08,0.7092796103183853,0.5893046631085405,0.05559007455817056,1.1275123757830217e-06,depthwise,3.358501323179382e-08,8,0.45807383753739855,0.7155431381469171,174,COMPLETE
25,0.812427,2021-08-15 19:09:00.423363,2021-08-15 19:10:26.790276,0 days 00:01:26.366913,5.5213756291549775e-08,0.8808375645419855,0.9162332833123991,0.003435435684145878,0.00018873586487599386,depthwise,1.1917805171694552e-06,6,2.322987689738809,0.7774744329705845,5305,COMPLETE
26,0.8127300000000001,2021-08-15 19:10:26.790704,2021-08-15 19:12:26.497923,0 days 00:01:59.707219,2.0303034794439036e-06,0.8360100125474238,0.8999433921222915,0.0024989095343506337,2.0182861488551384e-07,lossguide,1.3344736911459752e-06,6,2.597589995696898,0.5966183326980607,7445,COMPLETE
27,0.7734663333333334,2021-08-15 19:12:26.498366,2021-08-15 19:12:29.538824,0 days 00:00:03.040458,2.2842960803223948e-06,0.867649413108518,0.9464076979262167,0.0001607807365958886,1.1838857403508407e-07,lossguide,4.677950338948589e-07,6,3.160726852311322,0.5992559341068948,69,COMPLETE
28,0.8126496666666666,2021-08-15 19:12:29.539269,2021-08-15 19:13:55.626816,0 days 00:01:26.087547,4.735004947571651e-08,0.850457866815266,0.7019142450380605,0.0034165614343344823,4.40633601330543e-05,lossguide,8.631190205199343e-06,6,1.9961848092471757,0.46398558471388407,5561,COMPLETE
29,0.7780213333333332,2021-08-15 19:13:55.627264,2021-08-15 19:14:00.022481,0 days 00:00:04.395217,3.311083119382654e-08,0.8628946316248497,0.8090654571916671,0.0005511257448763455,2.742387553466335e-05,lossguide,8.57595656023105e-06,6,5.800562849251971,0.45666365129055364,147,COMPLETE
30,0.7728143333333333,2021-08-15 19:14:00.022914,2021-08-15 19:14:03.976702,0 days 00:00:03.953788,8.954516186424649e-07,0.9767944172822693,0.9216106356099514,1.763014810425944e-05,3.2713860519769183e-06,lossguide,0.00013063984725299177,6,18.24722372752034,0.6257837750199833,119,COMPLETE
31,0.8126966666666666,2021-08-15 19:14:03.977141,2021-08-15 19:15:21.783201,0 days 00:01:17.806060,6.371075821278425e-08,0.8214328085661196,0.7101475885962589,0.003583568193179161,0.004312867648699522,lossguide,1.3969669156037486e-06,7,2.2314398765604837,0.3627410306203839,3830,COMPLETE
32,0.8128003333333332,2021-08-15 19:15:21.783739,2021-08-15 19:16:59.079493,0 days 00:01:37.295754,1.0228356795156403e-08,0.8440283071583063,0.7043078286456518,0.002740834179884068,0.00027796105070252737,lossguide,1.1718872525405816e-06,7,2.4706271095445493,0.3365019807738471,4870,COMPLETE
33,0.8126876666666667,2021-08-15 19:16:59.080001,2021-08-15 19:20:05.206094,0 days 00:03:06.126093,1.1102114366670096e-08,0.8075613506293571,0.6954380582900426,0.0010291762252495028,0.001399584012752714,lossguide,7.701150228557121e-06,7,6.334162927333878,0.3151335614881121,10000,COMPLETE
34,0.8084566666666667,2021-08-15 19:20:05.206543,2021-08-15 19:23:34.105866,0 days 00:03:28.899323,1.7373903593360674e-08,0.790085859570598,0.7190596473357774,0.00045227924239261893,0.002072067585972578,lossguide,1.4642102578992027e-06,7,6.129228587708915,0.3127384518452016,10000,COMPLETE
35,0.8135976666666668,2021-08-15 19:23:34.106321,2021-08-15 19:26:35.404388,0 days 00:03:01.298067,3.214747450074563e-07,0.9220628655041823,0.7683165852181515,0.0014037570776271433,0.04044253258504038,lossguide,2.5727773223503257e-05,7,9.606163041753144,0.2873368131736097,10000,COMPLETE
36,0.813809,2021-08-15 19:26:35.404844,2021-08-15 19:29:40.314620,0 days 00:03:04.909776,2.6709106249644995e-05,0.9245514736189748,0.7626272254106683,0.001501356371272822,0.05876199251130858,lossguide,1.748703222894039e-05,7,9.781730284959416,0.37073102523410745,10000,COMPLETE
37,0.8139863333333333,2021-08-15 19:29:40.315082,2021-08-15 19:33:36.655710,0 days 00:03:56.340628,2.7959332158382658e-05,0.9281969900459697,0.8245289149422113,0.0012054621447052556,0.08403231416240525,lossguide,7.874608261364736e-05,8,7.820297888267846,0.2622260906483902,10000,COMPLETE
38,0.7907609999999999,2021-08-15 19:33:36.656168,2021-08-15 19:33:54.314614,0 days 00:00:17.658446,2.775582778067078e-05,0.9384598335220427,0.7794359206487613,0.00012109669264932641,0.7214298424801168,lossguide,3.797738282875288e-05,8,12.590410899836446,0.27080079465828405,462,COMPLETE
39,0.8137043333333333,2021-08-15 19:33:54.315052,2021-08-15 19:37:49.193590,0 days 00:03:54.878538,0.0002778006251430676,0.9915691892600668,0.8410961986147878,0.0010123383475288124,0.047334309310130336,lossguide,0.0005125348787870709,8,9.98913010674993,0.2609268067246892,10000,COMPLETE
40,0.8068960000000001,2021-08-15 19:37:49.194056,2021-08-15 19:42:55.810697,0 days 00:05:06.616641,0.0002620736358874406,0.9322240356077502,0.8498272916228947,0.0002853251525694709,0.036330631783526676,lossguide,0.0018753545272779998,8,9.315644238678459,0.26943176092184856,10000,COMPLETE
41,0.8128136666666667,2021-08-15 19:42:55.811136,2021-08-15 19:46:13.793292,0 days 00:03:17.982156,0.0015992187108566222,0.9974790171844536,0.7532635147390981,0.0009996347404510946,0.3129544955590082,lossguide,0.0002865063245717426,7,8.624940636219849,0.3882602010677645,10000,COMPLETE
42,0.8146373333333333,2021-08-15 19:46:13.793744,2021-08-15 19:50:14.270734,0 days 00:04:00.476990,0.011084237048879014,0.9967156843310309,0.8390153937874032,0.0013484038093758749,0.308321083006894,lossguide,0.00037269266298290907,9,19.780564624264613,0.40929873242019427,9141,COMPLETE
43,0.7922750000000001,2021-08-15 19:50:14.271180,2021-08-15 19:50:23.125583,0 days 00:00:08.854403,0.018095263360520322,0.9096149228768713,0.8397531408632187,4.1481616690931304e-05,0.06132030468621264,lossguide,0.0014128553653276824,9,18.816577172124116,0.2719551318817905,148,COMPLETE
44,0.8135436666666668,2021-08-15 19:50:23.126010,2021-08-15 19:55:06.235130,0 days 00:04:43.109120,7.304101109843618e-05,0.9551188398514898,0.7565839866492468,0.0010386742486354628,0.22368612628035145,lossguide,5.6535443513264675e-05,8,4.375124819143554,0.4151932239591701,10000,COMPLETE
45,0.7929186666666667,2021-08-15 19:55:06.235575,2021-08-15 19:55:19.226212,0 days 00:00:12.990637,0.00021356136947171646,0.9879412728455826,0.8318191672385618,1.1133203604436386e-08,0.023274744057181843,lossguide,0.0038606184010158227,9,14.400868139916854,0.2325546269111759,239,COMPLETE
46,0.8134,2021-08-15 19:55:19.226635,2021-08-15 19:55:42.083905,0 days 00:00:22.857270,0.9687986558244878,0.9045638809399834,0.8747216338057329,0.015249884084413386,0.44413372718110383,lossguide,0.0004018663221676982,8,10.045810399647657,0.2067343854892028,1019,COMPLETE
47,0.7966183333333333,2021-08-15 19:55:42.084331,2021-08-15 19:56:19.179543,0 days 00:00:37.095212,2.2310789686911214e-05,0.9602358577484977,0.6351642231753449,0.0002038394005041839,0.16207776735099125,lossguide,8.96606842934193e-05,9,4.305464160185597,0.3896938539238913,609,COMPLETE
48,0.7910369999999999,2021-08-15 19:56:19.179968,2021-08-15 19:56:27.294640,0 days 00:00:08.114672,0.0012678287892949433,0.8907367803029357,0.8021792180925,1.2695321987082917e-05,0.06072705003410647,lossguide,0.013126952847081243,8,8.18650436241547,0.2530237129367545,158,COMPLETE
49,0.793232,2021-08-15 19:56:27.295065,2021-08-15 19:56:38.628797,0 days 00:00:11.333732,0.010148688810297665,0.7478255974651857,0.7551489929945322,6.005460501900367e-08,0.020816477478573132,lossguide,2.1389060296149677e-05,9,14.241885945747637,0.3020491625803002,213,COMPLETE
50,0.7925856666666666,2021-08-15 19:56:38.629220,2021-08-15 19:56:46.940569,0 days 00:00:08.311349,4.626027469181728e-06,0.9998574282865965,0.6489921461273082,6.78252614279676e-05,0.9771978254043662,lossguide,0.0001244979221007146,9,19.7314753486499,0.4954805086571732,124,COMPLETE
51,0.8135263333333332,2021-08-15 19:56:46.941000,2021-08-15 20:01:22.931636,0 days 00:04:35.990636,9.108555471384941e-05,0.9519166891540503,0.755221342393377,0.0010880658562530986,0.20615984003588889,lossguide,6.562948410427375e-05,8,4.096286209145762,0.42152581128965577,9609,COMPLETE
