number,value,datetime_start,datetime_complete,duration,params_alpha,params_colsample_bylevel,params_colsample_bytree,params_eta,params_gamma,params_grow_policy,params_lambda,params_max_depth,params_min_child_weight,params_subsample,user_attrs_n_estimators,state
0,0.7483879999999999,2021-08-15 20:01:24.005285,2021-08-15 20:01:25.885524,0 days 00:00:01.880239,2.5176589668473013e-07,0.8239797570766343,0.25797797958882324,1.1877717275817536e-05,0.020303993397830844,depthwise,2.8429965011145407e-05,3,0.2336808884824901,0.3988864887243686,82,COMPLETE
1,0.7574063333333334,2021-08-15 20:01:25.885958,2021-08-15 20:01:28.559459,0 days 00:00:02.673501,0.00019481365823512768,0.23459074697231597,0.31081600585191266,3.511296432232145e-07,0.0407155508096707,lossguide,3.287126761619492e-08,5,0.1512065425276328,0.8689819531275036,151,COMPLETE
2,0.7696456666666666,2021-08-15 20:01:28.559883,2021-08-15 20:01:36.303499,0 days 00:00:07.743616,0.00046300961178889744,0.20778121755543896,0.6803783274629095,2.5075087912052024e-05,0.0006372141922034504,lossguide,4.521385897543096e-08,9,1.9092998999240558,0.8335082023560099,145,COMPLETE
3,0.6965123333333333,2021-08-15 20:01:36.303943,2021-08-15 20:01:37.828381,0 days 00:00:01.524438,0.00630208601588344,0.523865221101504,0.8025716642164633,3.9124594102522477e-08,1.7445605740395534e-07,lossguide,0.002412017436160065,1,0.16128007341964223,0.8883912230832651,90,COMPLETE
4,0.7643933333333334,2021-08-15 20:01:37.828803,2021-08-15 20:01:42.196042,0 days 00:00:04.367239,2.954879141177279e-06,0.8778935504274947,0.6837284874783978,2.9619970867179053e-06,0.00633555599832533,depthwise,0.009513736084489985,7,0.18987125951531802,0.8265022468381409,118,COMPLETE
5,0.747462,2021-08-15 20:01:42.196454,2021-08-15 20:01:43.694664,0 days 00:00:01.498210,0.00015010767446716397,0.20418019983320246,0.429553220166995,3.89117979479007e-06,1.182931379140747e-08,lossguide,0.0011470769267905982,4,1.6551592660664667,0.4240533360107832,45,COMPLETE
6,0.7335606666666666,2021-08-15 20:01:43.695093,2021-08-15 20:01:45.053424,0 days 00:00:01.358331,1.7233718723302013e-05,0.376800311925328,0.30130610777698597,0.0023660388714417018,0.024826659561800885,depthwise,2.6063802148087476e-06,2,10.961611875415421,0.48148671519107583,47,COMPLETE
7,0.7627363333333333,2021-08-15 20:01:45.053841,2021-08-15 20:01:50.982098,0 days 00:00:05.928257,0.8437446684638118,0.700091773782211,0.34127731574522296,1.1800503691933464e-08,0.003687795185352957,lossguide,0.011523076584627114,7,0.01497450651396922,0.4552092859537007,246,COMPLETE
8,0.7184093333333333,2021-08-15 20:01:50.982553,2021-08-15 20:01:52.236011,0 days 00:00:01.253458,0.0008244447603244675,0.6770987546828544,0.4469462091023442,2.8276551922782043e-06,0.5132094195168146,lossguide,0.026451525914413875,1,0.011597995529110052,0.6221532471416173,46,COMPLETE
9,0.7541446666666666,2021-08-15 20:01:52.236424,2021-08-15 20:01:57.808360,0 days 00:00:05.571936,1.9697224200155265e-06,0.6975992008323258,0.7291082379445066,2.7284144824480995e-05,8.96730638910596e-06,lossguide,0.006556369950361289,5,0.015529434369080442,0.3525031675002224,407,COMPLETE
10,0.7738216666666666,2021-08-15 20:01:57.808792,2021-08-15 20:02:00.741151,0 days 00:00:02.932359,0.03493416204530092,0.46480991317524334,0.9833221311935052,0.407374671661477,7.490562536933695e-05,depthwise,1.3053590969639673e-08,9,2.169303879606867,0.9967978921304324,19,COMPLETE
11,0.7817886666666668,2021-08-15 20:02:00.741577,2021-08-15 20:02:07.936849,0 days 00:00:07.195272,0.05316051405442071,0.4202496977070461,0.9800198944883062,0.06469307144971455,9.050601020601562e-05,depthwise,1.5808781001514243e-08,9,2.070406741555258,0.998772439332547,133,COMPLETE
12,0.7663313333333334,2021-08-15 20:02:07.937272,2021-08-15 20:02:10.296755,0 days 00:00:02.359483,0.09384469180269424,0.4666616708446503,0.9765933870577536,0.8007613688828606,1.5777451308478654e-05,depthwise,5.457742266082209e-07,9,4.850636567051494,0.9686784949756574,8,COMPLETE
13,0.7624056666666666,2021-08-15 20:02:10.297171,2021-08-15 20:02:11.990361,0 days 00:00:01.693190,0.018806812440728696,0.39560587635706845,0.9910644942270602,0.9247250741412577,8.424290457439378e-05,depthwise,0.8432625041132131,7,0.9442378564064429,0.6848150744261657,9,COMPLETE
14,0.7853773333333334,2021-08-15 20:02:11.990788,2021-08-15 20:02:37.319723,0 days 00:00:25.328935,0.2914250534311368,0.5535642395698612,0.863858269542996,0.013981850851846007,1.894830186811869e-06,depthwise,1.8194471200020605e-08,8,14.826501339982102,0.9781843275654988,1134,COMPLETE
15,0.7859746666666667,2021-08-15 20:02:37.320153,2021-08-15 20:03:24.263052,0 days 00:00:46.942899,0.41948417546008154,0.5656760651211464,0.8297522374460489,0.006980983812154295,9.529124747718416e-07,depthwise,6.62004595590745e-07,8,17.879723993518617,0.20939613632235293,3059,COMPLETE
16,0.783728,2021-08-15 20:03:24.263485,2021-08-15 20:05:40.458466,0 days 00:02:16.194981,0.9893548548445438,0.5847628974549227,0.8443026284566227,0.00103566812152903,8.10713537780255e-07,depthwise,5.696534524410938e-07,7,16.034776960589536,0.20669138093837822,10000,COMPLETE
17,0.7856753333333334,2021-08-15 20:05:40.458910,2021-08-15 20:06:09.856033,0 days 00:00:29.397123,0.005636052145782216,0.605871832941436,0.8460454400539292,0.00881930618416243,3.776098420137594e-07,depthwise,1.4295069677335795e-05,8,6.707254912321985,0.22840464225380402,1459,COMPLETE
18,0.782218,2021-08-15 20:06:09.856463,2021-08-15 20:08:14.581605,0 days 00:02:04.725142,0.003336898198372878,0.7807119152352834,0.5590041226849449,0.000893779163756791,3.307499612611677e-08,depthwise,7.137849481671365e-05,6,6.463923849596493,0.22786443800392212,10000,COMPLETE
19,0.7860206666666666,2021-08-15 20:08:14.582041,2021-08-15 20:08:45.213371,0 days 00:00:30.631330,0.0029144124519658136,0.9327502180788168,0.570204697405376,0.009804938376410475,2.1604014588390396e-07,depthwise,8.53206014727451e-06,8,5.382721904364814,0.31536639218394386,1393,COMPLETE
20,0.7616993333333334,2021-08-15 20:08:45.213802,2021-08-15 20:08:47.385028,0 days 00:00:02.171226,5.280109299043897e-08,0.9908450757079399,0.5651807237888731,0.00011730722570476214,8.243450939851066e-08,depthwise,0.000282148304133596,6,0.5664179870138945,0.5476122022998989,48,COMPLETE
21,0.7849026666666666,2021-08-15 20:08:47.385447,2021-08-15 20:09:01.020295,0 days 00:00:13.634848,0.002697715049659319,0.9906914675475864,0.7732168210368405,0.02243313464490537,5.20150369178021e-07,depthwise,1.0824740260030246e-05,8,4.605639917663182,0.300227895814065,539,COMPLETE
22,0.7862423333333334,2021-08-15 20:09:01.020719,2021-08-15 20:09:46.876423,0 days 00:00:45.855704,2.9884886781125816e-05,0.8965601220004003,0.6317694339000476,0.006747676136670291,4.799962091774233e-06,depthwise,2.820766221286474e-06,8,8.603252538696108,0.28594287135083674,2344,COMPLETE
23,0.7837693333333333,2021-08-15 20:09:46.876853,2021-08-15 20:09:52.291924,0 days 00:00:05.415071,2.4772339345639716e-05,0.880940737156496,0.4811610763429975,0.07733692598399243,5.688714842418586e-06,depthwise,2.78362762730796e-07,8,9.019168908754919,0.2980052512513259,210,COMPLETE
24,0.7592286666666667,2021-08-15 20:09:52.292350,2021-08-15 20:09:54.176808,0 days 00:00:01.884458,3.247692990746336e-05,0.9233209943460784,0.6367150067098941,0.00026104108072144835,2.8008399529367e-06,depthwise,2.8593847705989375e-06,6,12.737150010478485,0.32128736293196575,34,COMPLETE
25,0.7865206666666666,2021-08-15 20:09:54.177239,2021-08-15 20:12:02.019250,0 days 00:02:07.842011,1.2384727884241323e-08,0.7713512917672967,0.5068745551427178,0.0021858611589475,1.991024162062938e-05,depthwise,2.6847763423916516e-06,8,19.94063662748056,0.3787469165129477,8290,COMPLETE
26,0.7828806666666667,2021-08-15 20:12:02.019720,2021-08-15 20:12:05.718765,0 days 00:00:03.699045,1.9264982156052395e-08,0.7637851643577054,0.5243896072030804,0.09500169825087908,0.0005006501023345194,depthwise,4.333933359855227e-06,5,3.377180690878574,0.3720635906333225,257,COMPLETE
27,0.7848266666666666,2021-08-15 20:12:05.719187,2021-08-15 20:13:42.188658,0 days 00:01:36.469471,4.3969776841409546e-07,0.91773088824126,0.4104134463635798,0.002554328424756717,2.115504110027618e-05,depthwise,0.00015309934412188,7,0.04421815510738935,0.5381446365120734,5340,COMPLETE
28,0.7623713333333333,2021-08-15 20:13:42.189094,2021-08-15 20:13:46.825133,0 days 00:00:04.636039,3.999779540440376e-06,0.8150874564842715,0.6154861292011069,0.0004374477686669048,1.1383193549313805e-07,depthwise,2.2939740859445092e-07,6,3.479978802283635,0.2814024240337083,225,COMPLETE
29,0.7796463333333333,2021-08-15 20:13:46.825558,2021-08-15 20:14:56.518276,0 days 00:01:09.692718,1.8086099027203282e-07,0.8445921031822061,0.4877026810930688,0.003090923589036695,0.00043051955572696263,depthwise,2.829155863280574e-05,3,0.35468847759342953,0.3912952753360304,10000,COMPLETE
30,0.7839043333333334,2021-08-15 20:14:56.518783,2021-08-15 20:15:11.755445,0 days 00:00:15.236662,7.336156335027378e-07,0.9449223054952778,0.5690376854523191,0.027641153219828133,2.853993990618284e-05,depthwise,1.27791206801622e-07,9,1.0860721997773402,0.510191656105636,318,COMPLETE
31,0.786136,2021-08-15 20:15:11.755874,2021-08-15 20:16:03.716861,0 days 00:00:51.960987,0.0011463065477409445,0.7552679997511993,0.38363193807932827,0.005886188402242556,1.416332763009571e-06,depthwise,1.3029939798590866e-06,8,19.25433857625553,0.25988517350933893,3735,COMPLETE
32,0.7818183333333333,2021-08-15 20:16:03.717292,2021-08-15 20:16:06.601796,0 days 00:00:02.884504,0.0009989429794396735,0.7699034611742873,0.3679132686678646,0.16779747052743554,4.714521221831205e-06,depthwise,1.63635733525776e-06,8,18.907466706443945,0.2654477735881931,113,COMPLETE
33,0.760776,2021-08-15 20:16:06.602231,2021-08-15 20:16:10.736593,0 days 00:00:04.134362,5.846338830724007e-05,0.8292661770125986,0.2053765866294227,0.00012811912743280291,1.5666906968345086e-06,depthwise,6.258610534932285e-06,8,7.510561583519898,0.355053146993591,160,COMPLETE
34,0.7860743333333334,2021-08-15 20:16:10.737019,2021-08-15 20:17:06.216960,0 days 00:00:55.479941,0.0003548329312572792,0.6548050295517401,0.6661815223530021,0.004724617147896345,3.0956343956912086e-07,depthwise,4.171337100355442e-05,7,9.783915284310616,0.4197536215976063,3516,COMPLETE
35,0.78371,2021-08-15 20:17:06.217400,2021-08-15 20:19:50.376338,0 days 00:02:44.158938,0.0003369337047599471,0.6242123296447677,0.7076340309224657,0.0008433032163470809,3.4495205107110476e-05,depthwise,6.715597064749376e-08,7,10.578781532030247,0.42671241121726217,10000,COMPLETE
36,0.7723436666666667,2021-08-15 20:19:50.376789,2021-08-15 20:20:07.317652,0 days 00:00:16.940863,9.670937434259735e-06,0.7236204522220337,0.65694702870508,2.7721356561170825e-05,1.7517077860467722e-08,lossguide,6.165099874043556e-05,9,0.08254041845325377,0.6383181854856886,260,COMPLETE
37,0.7508983333333333,2021-08-15 20:20:07.318079,2021-08-15 20:20:08.797803,0 days 00:00:01.479724,0.00016790145922749685,0.6662913595465854,0.505910855143433,0.003965218496948964,4.8437482240785825e-08,depthwise,0.00046537758869615454,4,19.298048643488812,0.702062720600803,48,COMPLETE
38,0.7849803333333333,2021-08-15 20:20:08.798238,2021-08-15 20:20:22.029906,0 days 00:00:13.231668,7.813304410271274e-05,0.2752620823607551,0.3924036370737758,0.032761681384503555,2.9893836777479957e-07,lossguide,1.227222988315236e-06,7,3.39894565447425,0.427040909488507,884,COMPLETE
39,0.7637926666666667,2021-08-15 20:20:22.030341,2021-08-15 20:20:23.711709,0 days 00:00:01.681368,0.0010138369797499302,0.6430419892773074,0.29840798803956103,0.0002884290652555615,0.0015176720891402315,depthwise,2.0869713565955394e-05,6,10.9194162594602,0.26120461107095266,36,COMPLETE
40,0.7861343333333334,2021-08-15 20:20:23.712146,2021-08-15 20:23:44.752752,0 days 00:03:21.040606,0.012755629764788778,0.7176312202851967,0.761362531434743,0.0015875747961114175,0.00022800161672064116,lossguide,4.327590636426044e-05,9,7.569054286097153,0.4774016757620624,6975,COMPLETE
41,0.786226,2021-08-15 20:23:44.753203,2021-08-15 20:26:16.880775,0 days 00:02:32.127572,0.013148540492385372,0.7337502888235946,0.7531855253701233,0.0020190240138771376,0.0002030000134997005,lossguide,6.150146919972403e-05,9,10.41017036900593,0.4830213756552444,5587,COMPLETE
42,0.7860673333333333,2021-08-15 20:26:16.881217,2021-08-15 20:29:16.384618,0 days 00:02:59.503401,0.012687208306416913,0.7376482862356601,0.7679173300776542,0.0017818613644106987,0.0011972968721079274,lossguide,0.0009024224159577943,9,7.825046462760745,0.49673640297884786,6155,COMPLETE
43,0.7840753333333333,2021-08-15 20:29:16.385065,2021-08-15 20:34:25.308964,0 days 00:05:08.923899,0.10686044853243121,0.8029060511582101,0.8975580600141414,0.0005824712435619901,0.0002747962097967367,lossguide,0.00012068371005032642,9,10.793790313639096,0.475076637867844,10000,COMPLETE
44,0.7705986666666668,2021-08-15 20:34:25.309414,2021-08-15 20:34:34.114965,0 days 00:00:08.805551,0.009226660079371823,0.870172214342543,0.7384689320414951,7.602761947028537e-05,0.00016775574657599298,lossguide,2.030609634191707e-06,9,3.8035295132705182,0.5794488677686574,110,COMPLETE
45,0.7689256666666667,2021-08-15 20:34:34.115396,2021-08-15 20:34:41.254432,0 days 00:00:07.139036,0.0314586534228102,0.7324289909774293,0.6940552332525469,4.011627249951492e-07,0.0038110424865978702,lossguide,4.367540832207982e-06,8,2.4690034633604037,0.33921335044332734,155,COMPLETE
46,0.7868883333333333,2021-08-15 20:34:41.254847,2021-08-15 20:37:45.393833,0 days 00:03:04.138986,9.945265002047072e-08,0.862834780379904,0.4543104517082894,0.0018719819833799393,0.11157458856208569,lossguide,0.0017435537475137947,9,14.23616245459693,0.45455359915652865,7903,COMPLETE
47,0.7863576666666668,2021-08-15 20:37:45.394263,2021-08-15 20:38:02.858822,0 days 00:00:17.464559,1.1010345737033195e-08,0.8798178732290631,0.43313661035508805,0.020260674107160627,0.3732382413873584,lossguide,0.003566294294533555,8,13.717646403346246,0.3859329474659402,1021,COMPLETE
48,0.7772226666666667,2021-08-15 20:38:02.859246,2021-08-15 20:38:06.866975,0 days 00:00:04.007729,1.100388820904361e-08,0.8847572996375098,0.4546871449880405,0.15731632551158964,0.21040756747079237,lossguide,0.0460936944085558,9,1.5935644378220848,0.38748799185458177,53,COMPLETE
49,0.786636,2021-08-15 20:38:06.867390,2021-08-15 20:38:26.228285,0 days 00:00:19.360895,5.856455723491777e-08,0.8578436995935773,0.44101769119852846,0.018359321137458202,0.12816511131839223,lossguide,0.0034502556659683345,9,13.887103420816548,0.4442512736707289,879,COMPLETE
50,0.7815296666666667,2021-08-15 20:38:26.228706,2021-08-15 20:39:28.282661,0 days 00:01:02.053955,7.375428495285014e-08,0.8452379938523575,0.3544710046134476,0.016479926210836465,0.08318522662585684,lossguide,0.004375987249323753,2,13.180066473773703,0.44254756423245384,10000,COMPLETE
51,0.7797253333333334,2021-08-15 20:39:28.283088,2021-08-15 20:39:30.568574,0 days 00:00:02.285486,4.379794099589321e-08,0.9022349112092485,0.4422485777822676,0.3208694125781513,0.8568355121661378,lossguide,0.021013415468494456,9,13.77127243242128,0.5178793161118846,30,COMPLETE
52,0.7857156666666668,2021-08-15 20:39:30.568987,2021-08-15 20:39:43.767789,0 days 00:00:13.198802,1.40817438903767e-07,0.9547826671120258,0.5352636456969546,0.026828811987622183,0.01927898947080376,lossguide,0.0014596987682687405,8,6.15848723517685,0.46065735235536276,519,COMPLETE
53,0.7860803333333332,2021-08-15 20:39:43.768214,2021-08-15 20:39:53.856391,0 days 00:00:10.088177,3.360027497393278e-08,0.8020452615188424,0.3297163956865561,0.04696093511167259,0.23885485926023725,lossguide,0.10021439893191447,9,13.620777794062333,0.4075885165605441,499,COMPLETE
54,0.7864083333333333,2021-08-15 20:39:53.856808,2021-08-15 20:40:25.014740,0 days 00:00:31.157932,1.019279209673518e-08,0.854862845287648,0.4647158322455772,0.010963481068941603,0.03336351132883114,lossguide,0.0032617443679244552,9,5.343566559305386,0.3636102127743951,1218,COMPLETE
55,0.7859273333333334,2021-08-15 20:40:25.015184,2021-08-15 20:40:54.883165,0 days 00:00:29.867981,1.0293749684173011e-08,0.9606084096613391,0.4787452333038413,0.010049832050098018,0.04617927930972859,lossguide,0.004126550539553255,8,5.01808333384213,0.34565747040160993,1300,COMPLETE
56,0.7863013333333333,2021-08-15 20:40:54.883590,2021-08-15 20:41:15.578449,0 days 00:00:20.694859,2.1699694497093492e-08,0.8771615108006582,0.4136548854994906,0.014146113717464357,0.1523767991287591,lossguide,0.013081150110873829,8,8.692773869206114,0.38086855990741525,1111,COMPLETE
57,0.7866906666666665,2021-08-15 20:41:15.578870,2021-08-15 20:41:42.350684,0 days 00:00:26.771814,9.458423318160282e-08,0.8590423698775961,0.4118868024550654,0.01392332380419278,0.00931042392486113,lossguide,0.14651423013847173,9,15.511957994652334,0.3859161714846756,1347,COMPLETE
58,0.7862326666666668,2021-08-15 20:41:42.351111,2021-08-15 20:41:51.234850,0 days 00:00:08.883739,9.305026778170405e-08,0.8449821603052188,0.45424430097169116,0.04845078447688995,0.012773438786180338,lossguide,0.27814583161447115,9,15.74630119099839,0.7758258174332805,316,COMPLETE
59,0.7756660000000001,2021-08-15 20:41:51.235273,2021-08-15 20:41:53.879524,0 days 00:00:02.644251,5.185820765678658e-07,0.7958305433810111,0.30214476834543647,0.35173144679267954,0.06457105803307081,lossguide,0.0016410501003008857,9,4.479610460430557,0.5849700762165403,39,COMPLETE
60,0.7824096666666667,2021-08-15 20:41:53.879949,2021-08-15 20:41:57.075872,0 days 00:00:03.195923,2.3854416983279553e-08,0.8633249090075027,0.42531394599971967,0.14115784581209498,0.4690853382527108,lossguide,0.08611312211035502,9,14.223040402572556,0.3296698747790504,98,COMPLETE
61,0.786166,2021-08-15 20:41:57.076297,2021-08-15 20:42:19.218108,0 days 00:00:22.141811,1.7930565431835555e-08,0.8285356564431782,0.40399471622360145,0.014844780905323016,0.1790897291918529,lossguide,0.018542275161514014,8,6.223204158876114,0.38519131143651525,1175,COMPLETE
62,0.7863130000000002,2021-08-15 20:42:19.218533,2021-08-15 20:42:46.211222,0 days 00:00:26.992689,9.573641824285889e-08,0.9060535605943488,0.5171845186383116,0.01146685526332503,0.1077720461633857,lossguide,0.00869857118238018,8,8.697916302410897,0.45014855730718595,1210,COMPLETE
63,0.7864506666666666,2021-08-15 20:42:46.211708,2021-08-15 20:44:14.817061,0 days 00:01:28.605353,2.6021973608137105e-07,0.9687196611730173,0.5292514028925621,0.0038020266078707086,0.02937517151422221,lossguide,0.007646362867907642,7,19.52731739594218,0.4490023584883109,5973,COMPLETE
64,0.7867523333333333,2021-08-15 20:44:14.817507,2021-08-15 20:45:48.266087,0 days 00:01:33.448580,1.1080597893465883e-06,0.9733796212748888,0.47033923021588386,0.003593392264393528,0.00832592627301108,lossguide,0.004277299725591052,9,17.07686139378422,0.3643940814819068,4264,COMPLETE
65,0.7863743333333333,2021-08-15 20:45:48.266528,2021-08-15 20:49:17.213485,0 days 00:03:28.946957,1.2331632242153148e-06,0.9558945561720081,0.4664931709662094,0.0013397152786207912,0.029121550320327903,lossguide,0.00040352784167535527,9,19.497689741370557,0.35574664794047206,10000,COMPLETE
66,0.786594,2021-08-15 20:49:17.213937,2021-08-15 20:51:04.042080,0 days 00:01:46.828143,3.0407014125394866e-07,0.9977898303996781,0.5883965245147258,0.0031457386220295432,0.009066443816463642,lossguide,0.04032004500072565,9,19.761404871561385,0.5355957694061912,4457,COMPLETE
67,0.786506,2021-08-15 20:51:04.042521,2021-08-15 20:52:34.801345,0 days 00:01:30.758824,2.8596374859290045e-07,0.9811420642087303,0.5885434867175958,0.003434298404916503,0.008732524118511505,lossguide,0.3383927042400224,9,16.38377639647062,0.5427228506124739,3546,COMPLETE
68,0.7747866666666666,2021-08-15 20:52:34.801784,2021-08-15 20:53:04.637779,0 days 00:00:29.835995,2.9166469538486037e-07,0.9949475381407381,0.5796124165741883,0.0006714719786793792,0.007944897877415369,lossguide,0.7197767113195794,9,0.027463795332495013,0.5587651137954833,511,COMPLETE
69,0.771843,2021-08-15 20:53:04.638206,2021-08-15 20:53:13.780570,0 days 00:00:09.142364,2.033989807625355e-06,0.9255077565411061,0.6158109074398136,0.00036133853970709434,0.0027281455514756785,lossguide,0.16727973668033977,9,15.867098359020034,0.5305509069357625,178,COMPLETE
70,0.78674,2021-08-15 20:53:13.780997,2021-08-15 20:54:18.590356,0 days 00:01:04.809359,7.356705087157557e-07,0.9726896096906825,0.49632413493894106,0.0058787262510795486,0.009167650564291316,lossguide,0.49693776703081377,9,16.082893491124292,0.6625053725704678,2482,COMPLETE
71,0.7864956666666667,2021-08-15 20:54:18.590804,2021-08-15 20:55:14.535194,0 days 00:00:55.944390,9.781362241682746e-07,0.9738527573920497,0.5875228589114572,0.0061849506645027495,0.008619197901690068,lossguide,0.3894456031774397,9,11.136808534419103,0.650454940032432,1904,COMPLETE
72,0.7867913333333334,2021-08-15 20:55:14.535645,2021-08-15 20:57:30.427018,0 days 00:02:15.891373,4.759508019684699e-06,0.996800187114168,0.4950936343633484,0.002484218983307109,0.004412842813045078,lossguide,0.05558344899185586,9,16.206816924984423,0.6187216649022859,5198,COMPLETE
73,0.786674,2021-08-15 20:57:30.427458,2021-08-15 21:02:21.454290,0 days 00:04:51.026832,7.02150262142862e-06,0.9361943385181595,0.498759095066326,0.0011522796786549573,0.003879143354554162,lossguide,0.031823796940305044,9,11.819145754923657,0.7243930822108348,10000,COMPLETE
