number,value,datetime_start,datetime_complete,duration,params_alpha,params_colsample_bylevel,params_colsample_bytree,params_eta,params_gamma,params_grow_policy,params_lambda,params_max_depth,params_min_child_weight,params_subsample,user_attrs_n_estimators,state
75,0.8096960000000001,2021-08-15 03:15:43.893033,2021-08-15 03:15:53.330792,0 days 00:00:09.437759,1.89687733846713e-06,0.37163963572572123,0.8147282340051937,0.05338933381420756,7.997985501210445e-07,lossguide,0.3176943209802344,9,0.19152219602615994,0.8265307452180434,165,COMPLETE
76,0.812172,2021-08-15 03:15:53.331220,2021-08-15 03:16:30.902145,0 days 00:00:37.570925,5.143907194990063e-06,0.4154105230686992,0.7957117159107109,0.00781399052975889,5.831106465870867e-06,lossguide,0.49340386549948156,8,0.2685369386275748,0.35931784631655916,1420,COMPLETE
77,0.8079963333333332,2021-08-15 03:16:30.902590,2021-08-15 03:16:35.748790,0 days 00:00:04.846200,4.8004664781979565e-06,0.48766363247505495,0.8059366719245142,0.08168954470348387,2.0345794375350004e-05,lossguide,0.43623812576040455,8,0.27040757184998304,0.39716314226947924,109,COMPLETE
78,0.8120316666666666,2021-08-15 03:16:35.749222,2021-08-15 03:17:09.792565,0 days 00:00:34.043343,1.3920229574198123e-05,0.4329227332105815,0.746848959629044,0.007255876744119191,2.6504053851368136e-06,lossguide,0.4999633989931605,8,0.6488159230989933,0.3313543399547077,1301,COMPLETE
79,0.812576,2021-08-15 03:17:09.793001,2021-08-15 03:17:50.767518,0 days 00:00:40.974517,1.2853142718832382e-05,0.43049032493045913,0.7350053840871442,0.008314624292820141,2.7927001101485528e-06,lossguide,0.9661698160123091,9,0.7277507087912549,0.27707289209841635,1151,COMPLETE
80,0.8125573333333334,2021-08-15 03:17:50.768002,2021-08-15 03:18:24.390123,0 days 00:00:33.622121,1.897742157106041e-05,0.43151831664213697,0.7355385823739841,0.010340248405098423,5.70922676085042e-06,lossguide,0.8682842797765835,9,0.8945543160936587,0.27948048074712367,954,COMPLETE
81,0.8124399999999999,2021-08-15 03:18:24.390560,2021-08-15 03:19:04.997933,0 days 00:00:40.607373,1.525815864612759e-05,0.445242274802222,0.7457715758536553,0.00760435969552563,3.468225072749826e-06,lossguide,0.8353179356999593,9,0.7996678702715824,0.27535279832685877,1129,COMPLETE
82,0.8126853333333334,2021-08-15 03:19:04.998378,2021-08-15 03:20:34.449972,0 days 00:01:29.451594,1.6183508610077737e-05,0.429519461417359,0.7357204865060762,0.003481801518036172,3.2158786871074735e-06,lossguide,0.6567995756075463,9,0.8728573625594769,0.2624029864094679,2649,COMPLETE
83,0.8121173333333335,2021-08-15 03:20:34.450416,2021-08-15 03:20:58.560928,0 days 00:00:24.110512,1.7000400326200707e-05,0.4445019072940675,0.7465474284833586,0.014648078140580402,5.260998168847768e-06,lossguide,0.9766139838583728,9,0.9022652538721269,0.25447172218904274,676,COMPLETE
84,0.8120046666666667,2021-08-15 03:20:58.561371,2021-08-15 03:21:25.651252,0 days 00:00:27.089881,4.71842252253561e-05,0.429540529251239,0.7283253566225721,0.012943552662699741,2.468100669618028e-06,lossguide,0.7793292051469849,9,0.936801075938899,0.2452844395879909,790,COMPLETE
85,0.811928,2021-08-15 03:21:25.651691,2021-08-15 03:21:51.611912,0 days 00:00:25.960221,1.7785302712958975e-05,0.4388318764741548,0.7376720042981226,0.011280223383923977,2.4900288601715703e-06,lossguide,0.9978517807316832,9,0.9465835646668798,0.20023239368934903,768,COMPLETE
86,0.811946,2021-08-15 03:21:51.612356,2021-08-15 03:22:18.008089,0 days 00:00:26.395733,1.3707558123097498e-05,0.4385936082961832,0.7247965536844531,0.013135801210204582,2.489039270471618e-06,lossguide,0.8874443827359579,9,0.9688234736209764,0.21826796753484004,786,COMPLETE
87,0.8119339999999999,2021-08-15 03:22:18.008525,2021-08-15 03:22:40.190557,0 days 00:00:22.182032,4.668945517354556e-05,0.4680230396994025,0.7202382787334383,0.016095202918992513,1.810320168879228e-05,lossguide,0.6556849922363761,9,0.7619626388058501,0.26217908131199924,600,COMPLETE
88,0.8128606666666668,2021-08-15 03:22:40.191031,2021-08-15 03:24:00.686256,0 days 00:01:20.495225,1.3121853394754562e-05,0.41991335657133955,0.7502536523189941,0.0037231614229243748,6.255795740137442e-06,lossguide,0.16374326246385248,9,1.4492850904920425,0.31907574510939474,2398,COMPLETE
