number,value,datetime_start,datetime_complete,duration,params_alpha,params_colsample_bylevel,params_colsample_bytree,params_eta,params_gamma,params_grow_policy,params_lambda,params_max_depth,params_min_child_weight,params_subsample,user_attrs_n_estimators,state
76,0.7329423333333333,2021-08-15 04:01:23.860164,2021-08-15 04:01:26.079786,0 days 00:00:02.219622,6.190031742311663e-05,0.23331053797094614,0.5276110603315575,0.0012167335313364536,0.0034148212496053778,depthwise,0.0012662506399758278,2,19.693456690957376,0.9744470141293053,174,COMPLETE
77,0.779527,2021-08-15 04:01:26.080223,2021-08-15 04:01:30.450902,0 days 00:00:04.370679,0.00019239468485132604,0.22886227704333958,0.4387601944072288,0.00018344161769557308,0.00035954950482983275,depthwise,0.004179855644573777,9,9.585108733977721,0.9240396657057798,52,COMPLETE
78,0.814076,2021-08-15 04:01:30.451331,2021-08-15 04:02:27.003830,0 days 00:00:56.552499,2.6632508795041406e-05,0.2269602029771082,0.5605683474833155,0.007312497228489782,0.0018867688705607518,depthwise,0.009242172179165212,9,5.124898710572244,0.954175599887872,2067,COMPLETE
79,0.8149903333333333,2021-08-15 04:02:27.004273,2021-08-15 04:05:37.944066,0 days 00:03:10.939793,1.597515891384308e-05,0.25826378365016417,0.47366352885862417,0.0020911104768120995,0.0014448215092776517,depthwise,0.0002865794817155034,9,15.733559526847554,0.9779399710259935,8932,COMPLETE
80,0.8147143333333333,2021-08-15 04:05:37.944522,2021-08-15 04:08:37.580247,0 days 00:02:59.635725,7.131523228668959e-05,0.2722740986422182,0.6644973882976049,0.0020550946284606593,0.0071600111982691875,depthwise,0.00033553819535856344,9,15.334147543145527,0.9764412251157968,8054,COMPLETE
81,0.8147449999999999,2021-08-15 04:08:37.580698,2021-08-15 04:11:31.838458,0 days 00:02:54.257760,7.351834690068634e-05,0.2673671885696912,0.7009559777718595,0.0021029413467174604,0.007335295859365745,depthwise,0.00024390307553094683,9,15.770904182550485,0.9788154011854585,7788,COMPLETE
82,0.8129620000000001,2021-08-15 04:11:31.838911,2021-08-15 04:15:46.961430,0 days 00:04:15.122519,3.4173232712139705e-05,0.23952946679083204,0.5083026449182787,0.0008635637036378922,0.0014005995366326179,depthwise,0.00011835895306376407,9,12.538715703426137,0.9551726900692276,10000,COMPLETE
83,0.7838080000000001,2021-08-15 04:15:46.961888,2021-08-15 04:15:53.131336,0 days 00:00:06.169448,0.00020216524633794898,0.2618607017345171,0.40921713476933996,0.00045358882291681677,0.0032726873951937226,depthwise,7.281449162852273e-05,9,16.040645931146194,0.9987226439088913,114,COMPLETE
84,0.814418,2021-08-15 04:15:53.131773,2021-08-15 04:17:18.281967,0 days 00:01:25.150194,1.7582390641585647e-05,0.22883748952062385,0.5957883323915477,0.004777346799198158,0.00703815480482894,depthwise,0.0007332995188325,9,6.9433728302154485,0.9111764806273448,3372,COMPLETE
85,0.8145753333333333,2021-08-15 04:17:18.282421,2021-08-15 04:20:24.430561,0 days 00:03:06.148140,8.533096134227414e-05,0.26143002398414933,0.7213389025897953,0.0019597053182864835,0.00032293513676307737,depthwise,0.018521713020367297,9,11.759519930192862,0.9648630188646069,7837,COMPLETE
86,0.8120713333333334,2021-08-15 04:20:24.431021,2021-08-15 04:23:14.483574,0 days 00:02:50.052553,0.000311581612204271,0.2144547551405169,0.3927227336737106,0.0012579704712480076,0.0022187628852095914,depthwise,0.0017938000672686626,8,19.28014735774137,0.9826874941374354,10000,COMPLETE
87,0.8114173333333333,2021-08-15 04:23:14.484100,2021-08-15 04:24:13.183207,0 days 00:00:58.699107,0.0010747692371046256,0.24421267538279495,0.6201173299685333,0.0071398092495024105,4.6981910659487146e-05,depthwise,0.0003546881660122317,9,0.08879520434359389,0.9433066777936634,1322,COMPLETE
