number,value,datetime_start,datetime_complete,duration,params_alpha,params_colsample_bylevel,params_colsample_bytree,params_eta,params_gamma,params_grow_policy,params_lambda,params_max_depth,params_min_child_weight,params_subsample,user_attrs_n_estimators,state
0,0.6948153333333335,2021-08-15 03:24:01.770316,2021-08-15 03:24:03.357929,0 days 00:00:01.587613,2.1044355705501057e-06,0.8681734573855875,0.9702377149198946,2.2892010549902927e-06,4.815456840098732e-06,lossguide,0.0012842655257084051,2,0.582553887104571,0.3708985356567853,28,COMPLETE
1,0.794775,2021-08-15 03:24:03.358364,2021-08-15 03:24:05.991631,0 days 00:00:02.633267,0.001083821315872397,0.23236530200676225,0.823890922843965,0.2973832929462468,0.1453734166730835,lossguide,0.0032558941643625267,8,0.05858644650099692,0.5082073243953316,21,COMPLETE
2,0.8010996666666667,2021-08-15 03:24:05.992039,2021-08-15 03:24:08.122049,0 days 00:00:02.130010,9.077089805587183e-07,0.46866108104138465,0.8601418815489257,0.3871608933368714,1.3386309756929192e-07,lossguide,3.876699020774861e-07,8,5.898256778714787,0.4312261592113205,17,COMPLETE
3,0.7948453333333333,2021-08-15 03:24:08.122468,2021-08-15 03:24:28.331460,0 days 00:00:20.208992,0.3099995861123054,0.9788856027129855,0.7473783098315758,2.043637883389312e-07,0.0013665560879457521,depthwise,3.207935807684083e-06,9,0.06487135890086558,0.39651547383677477,304,COMPLETE
4,0.8124083333333333,2021-08-15 03:24:28.331881,2021-08-15 03:25:17.046330,0 days 00:00:48.714449,0.005026551834129627,0.7880982317954224,0.8002239092644972,0.0048572112500176,1.2828789817789544e-07,lossguide,0.00033854695668190395,6,2.4985478959541423,0.25776643781486963,3555,COMPLETE
5,0.7599736666666667,2021-08-15 03:25:17.046744,2021-08-15 03:25:19.310339,0 days 00:00:02.263595,0.0004453696959357518,0.8057040027315521,0.9837051127954473,9.992098825574791e-05,1.073666040739921e-06,depthwise,0.4514380618560858,4,0.2537596150020229,0.6705420813627478,116,COMPLETE
6,0.747124,2021-08-15 03:25:19.310745,2021-08-15 03:25:20.778884,0 days 00:00:01.468139,0.0008254779888450099,0.994020581266488,0.5434015346758378,0.0010840711326649494,0.4375780016300063,depthwise,0.00016455793993024113,3,4.075867734329798,0.7003938728208765,37,COMPLETE
7,0.755222,2021-08-15 03:25:20.779289,2021-08-15 03:25:22.720263,0 days 00:00:01.940974,1.799292720324779e-05,0.35840994874519655,0.2562397086202604,0.0003666278157022909,0.0020617605344494796,depthwise,9.311254100485466e-08,5,0.4312735604254863,0.9070321785884217,58,COMPLETE
8,0.671684,2021-08-15 03:25:22.720674,2021-08-15 03:25:24.896950,0 days 00:00:02.176276,3.740091431579298e-06,0.8819663775351834,0.23340559989062762,3.0861975059475627e-05,2.6663146464724367e-07,lossguide,0.00015138037983003838,1,1.6405705958803665,0.6032942824754186,191,COMPLETE
9,0.7697136666666667,2021-08-15 03:25:24.897354,2021-08-15 03:25:27.092696,0 days 00:00:02.195342,0.736180118361038,0.9331972703817131,0.5886659617656504,4.445673510800104e-08,1.1354993521570991e-07,lossguide,0.005802051074551298,5,3.959836017728884,0.47460300918588844,74,COMPLETE
10,0.8114796666666667,2021-08-15 03:25:27.093109,2021-08-15 03:25:53.797592,0 days 00:00:26.704483,0.02718586801470427,0.6885013842799464,0.4527586393341159,0.010363832828625416,1.3987089921779658e-08,lossguide,0.603007089817106,7,0.010137647154224445,0.22635777532412027,1446,COMPLETE
11,0.8104303333333333,2021-08-15 03:25:53.798006,2021-08-15 03:26:09.735541,0 days 00:00:15.937535,0.019691984841285592,0.6862033196235364,0.4568260935377439,0.01951869569421971,1.131558035663198e-08,lossguide,0.3292781389789799,7,0.014555566132506326,0.2304932196017923,827,COMPLETE
12,0.8089893333333333,2021-08-15 03:26:09.736002,2021-08-15 03:26:34.361767,0 days 00:00:24.625765,3.944664614990976e-08,0.6780927765712931,0.7132520868801218,0.008706790437307339,1.594396143431298e-05,lossguide,6.8891027633620395e-06,6,0.010892551750964383,0.2040165663629197,1633,COMPLETE
13,0.8119326666666667,2021-08-15 03:26:34.362208,2021-08-15 03:27:04.852906,0 days 00:00:30.490698,0.024083978016662372,0.5592082079730746,0.40832436811430284,0.010272778735392573,1.0977676874503255e-08,lossguide,0.03931452548393113,6,1.445275023064207,0.3006248390335967,2417,COMPLETE
14,0.8119276666666666,2021-08-15 03:27:04.853325,2021-08-15 03:29:07.113784,0 days 00:02:02.260459,0.01849804008806765,0.586471155527385,0.35846246575859564,0.001942304925330652,7.226270322267441e-05,lossguide,0.01646619432574627,6,1.4246437606304674,0.33676143069678066,10000,COMPLETE
15,0.8108156666666666,2021-08-15 03:29:07.114214,2021-08-15 03:29:14.446890,0 days 00:00:07.332676,0.004070096916157844,0.5138491700530113,0.6816020091641699,0.06402296052646203,1.0818512292491093e-08,lossguide,0.03810977323831177,4,16.2094215644721,0.3102566788262829,789,COMPLETE
16,0.7731523333333334,2021-08-15 03:29:14.447332,2021-08-15 03:29:17.575974,0 days 00:00:03.128642,6.887040863411294e-05,0.7665908958955698,0.37964165191980814,1.4220330279993473e-05,1.51573628154367e-06,lossguide,1.0868986206499957e-05,6,19.686244127589983,0.8204149799345766,111,COMPLETE
17,0.8104836666666667,2021-08-15 03:29:17.576391,2021-08-15 03:29:26.744046,0 days 00:00:09.167655,0.12192621563933355,0.4168119924995036,0.6335935414467996,0.0631908880967501,0.0008096611619021653,lossguide,0.00042036892217509243,4,1.0838739665514583,0.5321539087059312,1010,COMPLETE
18,0.8112503333333333,2021-08-15 03:29:26.744463,2021-08-15 03:31:23.051842,0 days 00:01:56.307379,0.00012732721305651278,0.5988519619105457,0.8370004180731053,0.0018907436523830552,7.484944228866876e-08,depthwise,0.06106044531841548,7,0.20018945367943378,0.28984303291767594,5896,COMPLETE
19,0.791591,2021-08-15 03:31:23.052273,2021-08-15 03:31:25.075605,0 days 00:00:02.023332,0.009184558806476565,0.2851608014009891,0.508701104300694,0.6621831988304023,3.293606799988719e-05,lossguide,3.988741318299333e-05,8,2.1883999533760083,0.5808169764893569,9,COMPLETE
20,0.7640013333333333,2021-08-15 03:31:25.076026,2021-08-15 03:31:26.997482,0 days 00:00:01.921456,0.08170134370952278,0.7582081151092777,0.3212231533223147,3.577847052439881e-06,1.118539473261718e-06,lossguide,0.07626143920863115,5,8.9761194348257,0.2902092721642465,60,COMPLETE
21,0.7769940000000001,2021-08-15 03:31:26.997894,2021-08-15 03:31:31.162655,0 days 00:00:04.164761,0.002315786722087714,0.5587093499605553,0.37720589680928873,0.0016521329392422328,0.015111347761403441,lossguide,0.014835024047026765,6,0.9074364833801148,0.35314847491416246,197,COMPLETE
22,0.7716063333333333,2021-08-15 03:31:31.163067,2021-08-15 03:31:34.156402,0 days 00:00:02.993335,0.05801381086966327,0.6276716383081846,0.33856460049144954,0.00032633626540166824,0.00018094807072812296,lossguide,0.0009015311500661442,6,2.161108806773917,0.3073052314235471,112,COMPLETE
23,0.812186,2021-08-15 03:31:34.156819,2021-08-15 03:32:23.251593,0 days 00:00:49.094774,0.009880137469388404,0.5258126321117474,0.40935690637933064,0.006685546873634453,0.00015463540205697324,lossguide,0.008239654158717552,5,3.00155952727248,0.42959544105063474,5089,COMPLETE
24,0.8105880000000001,2021-08-15 03:32:23.252020,2021-08-15 03:32:37.459859,0 days 00:00:14.207839,0.005256798901643279,0.45690841548855443,0.44225678528951956,0.05876525639845341,0.012444803960414783,lossguide,0.002810513715955093,3,8.504101312937784,0.4422597683851127,1933,COMPLETE
25,0.8119006666666667,2021-08-15 03:32:37.460282,2021-08-15 03:33:28.850101,0 days 00:00:51.389819,0.00022311251546317665,0.3809082022357664,0.5334178655126277,0.00568666769622556,5.555671111087175e-06,lossguide,0.10906834111322651,5,2.9221169453092295,0.40197040687100655,5364,COMPLETE
26,0.7764336666666667,2021-08-15 03:33:28.850518,2021-08-15 03:33:30.812731,0 days 00:00:01.962213,0.3548557066345132,0.533003616944183,0.28640480173443494,0.0002956161305997404,5.1634313527857904e-08,depthwise,5.2692298437689495e-05,7,0.5399217603088355,0.2691475034538487,14,COMPLETE
27,0.8096483333333334,2021-08-15 03:33:30.813151,2021-08-15 03:33:44.080330,0 days 00:00:13.267179,2.8407387838008295e-05,0.4846639247975497,0.7772167210420569,0.048188539301767,0.0002284054531672859,lossguide,1.26543448504101e-08,3,8.034263897259168,0.2002399262664257,1808,COMPLETE
28,0.8111483333333332,2021-08-15 03:33:44.080752,2021-08-15 03:35:04.390041,0 days 00:01:20.309289,0.0019313346047323853,0.641523464196233,0.6183623531135349,0.0043466079037629,3.03699301992966e-07,lossguide,0.011123721004593301,4,0.9001258096256476,0.48164880890575756,10000,COMPLETE
29,0.7957510000000001,2021-08-15 03:35:04.390466,2021-08-15 03:35:08.665719,0 days 00:00:04.275253,0.11121725990361991,0.8282792944115897,0.9132041679721954,0.17225517637805068,6.094724456063723e-06,lossguide,0.0008853414370293836,9,0.1965365837716585,0.3705993477860266,29,COMPLETE
30,0.7704596666666667,2021-08-15 03:35:08.666134,2021-08-15 03:35:10.438658,0 days 00:00:01.772524,0.009291240299945346,0.735689163990836,0.42291757092940774,7.760854971715329e-05,4.5829369575567453e-07,lossguide,0.000430440397974069,6,0.37981783198310437,0.9991126184416195,16,COMPLETE
31,0.8093126666666667,2021-08-15 03:35:10.439070,2021-08-15 03:36:46.983950,0 days 00:01:36.544880,0.04747421103819035,0.5633274457439779,0.3824470609798517,0.0014855054536274195,8.503532467026148e-05,lossguide,0.01651610037051398,5,1.8747180065574875,0.3426575473802816,10000,COMPLETE
32,0.7776283333333334,2021-08-15 03:36:46.984379,2021-08-15 03:36:50.742016,0 days 00:00:03.757637,0.013195815378927642,0.591299169867954,0.4896380676286122,0.0006112809215215368,0.006766547726486585,lossguide,0.0022389313073466898,6,1.287456491220441,0.25710945733584223,165,COMPLETE
33,0.8127113333333332,2021-08-15 03:36:50.742504,2021-08-15 03:37:11.838890,0 days 00:00:21.096386,0.0004526383935860476,0.5107200196168562,0.299478929758165,0.01879365503488748,0.04346741636011183,lossguide,0.13725940632562691,7,3.8608998883432153,0.3354559094883358,1374,COMPLETE
34,0.8131103333333334,2021-08-15 03:37:11.839312,2021-08-15 03:37:42.104409,0 days 00:00:30.265097,0.00059327031871534,0.4227408709681657,0.21015898060368848,0.01840776949448818,0.09879826765215939,lossguide,0.15686151032369378,8,5.741077172080705,0.414498574802428,1797,COMPLETE
35,0.804639,2021-08-15 03:37:42.104871,2021-08-15 03:37:44.792132,0 days 00:00:02.687261,0.0005682013631579436,0.337348870541114,0.28368186923602906,0.28340252800377463,0.047979285012832565,lossguide,0.20619862983459708,8,5.190086303447653,0.4113642473587447,60,COMPLETE
36,0.8132903333333333,2021-08-15 03:37:44.792544,2021-08-15 03:38:04.272396,0 days 00:00:19.479852,0.00032714949147885045,0.4307711264951357,0.20296779156028044,0.033055434614846634,0.9719887795404443,depthwise,0.201728176781637,8,13.140451598488765,0.5359403260510315,1593,COMPLETE
37,0.8124669999999999,2021-08-15 03:38:04.272810,2021-08-15 03:38:26.960069,0 days 00:00:22.687259,1.073558268744593e-05,0.21934699577832295,0.20486531375032327,0.03956303245586946,0.8826218751078789,depthwise,0.8623702493316338,9,13.587414139047256,0.5285402317113153,2421,COMPLETE
38,0.809975,2021-08-15 03:38:26.960502,2021-08-15 03:38:32.765239,0 days 00:00:05.804737,5.341463871249199e-06,0.20675891557978926,0.20378647317189977,0.1612146264073633,0.6737196605399738,depthwise,0.6000444440660077,9,12.836117342775479,0.5438885578082029,465,COMPLETE
39,0.8132419999999999,2021-08-15 03:38:32.765658,2021-08-15 03:39:05.393399,0 days 00:00:32.627741,1.241682359206334e-06,0.2931551403382199,0.20325658153349957,0.023675825397276307,0.18130448477799307,depthwise,0.9184990774598006,8,12.744964395116302,0.6629012163888421,2458,COMPLETE
40,0.791602,2021-08-15 03:39:05.393902,2021-08-15 03:39:07.160903,0 days 00:00:01.767001,8.817959638455261e-07,0.2843055862283453,0.2645003108777737,0.9541979445908808,0.16525260281222506,depthwise,0.17893618162668465,8,5.978495458409798,0.7125388464544897,10,COMPLETE
41,0.8132556666666666,2021-08-15 03:39:07.161318,2021-08-15 03:39:33.396235,0 days 00:00:26.234917,5.487200600141184e-07,0.2505353147887569,0.20366054287321564,0.027775145807697164,0.20298088016488047,depthwise,0.5327041019936769,8,11.867420623907563,0.6252221148365827,1964,COMPLETE
42,0.8134736666666668,2021-08-15 03:39:33.396659,2021-08-15 03:39:59.419143,0 days 00:00:26.022484,4.48511041986788e-07,0.27498694726523293,0.23844287483341756,0.022968832606798283,0.16001674333996052,depthwise,0.9865958216515036,8,11.324245823696359,0.6444898191164276,1743,COMPLETE
43,0.8109893333333332,2021-08-15 03:39:59.419567,2021-08-15 03:40:04.671245,0 days 00:00:05.251678,2.9116298351838484e-07,0.2940363038004216,0.23743686458784946,0.13582331075689433,0.2179346709630031,depthwise,0.9167569476012968,8,11.328666446615033,0.6392314077839981,272,COMPLETE
44,0.8129176666666668,2021-08-15 03:40:04.671683,2021-08-15 03:40:30.135773,0 days 00:00:25.464090,2.0131491441042688e-08,0.25343455674621507,0.23695395786777482,0.022279665444031285,0.05239927566919224,depthwise,0.25614679778653704,8,6.489945403941322,0.7531836059998065,1561,COMPLETE
45,0.8042943333333333,2021-08-15 03:40:30.136183,2021-08-15 03:40:32.646636,0 days 00:00:02.510453,1.5888200584516937e-07,0.3333395420825089,0.21416583535286993,0.4418380439797888,0.10849938752750428,depthwise,0.3225822217617674,9,19.816159456810905,0.6018215366270483,69,COMPLETE
46,0.7654169999999999,2021-08-15 03:40:32.647062,2021-08-15 03:40:36.845894,0 days 00:00:04.198832,1.0982247079361322e-06,0.3992738586202462,0.25747836049269,2.090929454221778e-08,0.37240883266750247,depthwise,0.03920557429266284,7,11.181649130187203,0.6624100579898862,147,COMPLETE
47,0.7763749999999999,2021-08-15 03:40:36.846323,2021-08-15 03:40:43.264112,0 days 00:00:06.417789,2.2622588007590036e-07,0.2508471796604293,0.3158274379769416,3.8367916565898654e-07,0.0826831308826248,depthwise,0.5239320652979234,9,4.349751239447721,0.7655592840578249,133,COMPLETE
48,0.8121693333333333,2021-08-15 03:40:43.264530,2021-08-15 03:41:07.583039,0 days 00:00:24.318509,4.366833606353787e-05,0.32090717248919487,0.2609927163409408,0.021993394791952076,0.36428642910922043,depthwise,0.946546103119102,8,0.07082152955676764,0.5703394155895066,1084,COMPLETE
49,0.811864,2021-08-15 03:41:07.583464,2021-08-15 03:41:12.391428,0 days 00:00:04.807964,9.309673680469778e-08,0.4235752586062582,0.3420943856261883,0.11134148304478758,0.01922957765010666,depthwise,0.09034441618152833,8,7.89992234013834,0.7150914051215186,176,COMPLETE
50,0.7697446666666666,2021-08-15 03:41:12.391876,2021-08-15 03:41:14.600412,0 days 00:00:02.208536,6.016709168322617e-07,0.4476740055390702,0.23354709304076493,0.0041695539093115925,0.003954302870985431,depthwise,3.4981044689799835e-07,7,13.918926974478023,0.6293540502378325,32,COMPLETE
51,0.8132223333333334,2021-08-15 03:41:14.600845,2021-08-15 03:41:46.604716,0 days 00:00:32.003871,2.05223842459576e-08,0.2613544694294364,0.23386040864836266,0.021013858468659143,0.040519235631163886,depthwise,0.32280207773737457,8,6.336989719523201,0.7655572915530076,1986,COMPLETE
52,0.8142809999999999,2021-08-15 03:41:46.605143,2021-08-15 03:42:24.796294,0 days 00:00:38.191151,1.4301624400627316e-08,0.36473440344437325,0.28962062745234174,0.013192364781917664,0.21524190131965476,depthwise,0.33095342603389843,8,10.014597159735215,0.8504621202286258,2246,COMPLETE
53,0.8141213333333334,2021-08-15 03:42:24.796719,2021-08-15 03:42:59.618790,0 days 00:00:34.822071,5.361649879522158e-08,0.36111621230816404,0.28192994704495855,0.01297795894425557,0.9618839970986441,depthwise,0.36046580839036124,9,9.449291947999106,0.8957445715971398,2233,COMPLETE
54,0.8077273333333332,2021-08-15 03:42:59.619188,2021-08-15 03:43:02.630475,0 days 00:00:03.011287,5.250802097759242e-08,0.3695665614709989,0.2709858005207043,0.2904005935081629,0.2905857916754917,depthwise,0.03207871788488923,9,10.036370462582365,0.8971099071523234,68,COMPLETE
55,0.814436,2021-08-15 03:43:02.630897,2021-08-15 03:45:26.820113,0 days 00:02:24.189216,1.955953516441229e-06,0.31014398617146444,0.3147576661804353,0.0027715948537045954,0.9191801117182983,depthwise,0.41022349297720867,9,17.078884568913338,0.8656593082700152,10000,COMPLETE
56,0.779162,2021-08-15 03:45:26.820559,2021-08-15 03:45:29.378590,0 days 00:00:02.558031,2.2137325649863487e-06,0.3515027046879186,0.34377325486956256,0.0030665841891008815,0.5568274892091822,depthwise,0.334219081023034,9,16.64886561462114,0.864775033425466,12,COMPLETE
57,0.7789609999999999,2021-08-15 03:45:29.379005,2021-08-15 03:45:36.781425,0 days 00:00:07.402420,1.0285715164278724e-08,0.31358487585688405,0.3099350575520724,0.0006461717307513246,0.8071810868788506,depthwise,0.07923136615595311,9,18.478621177451426,0.9608282844862033,202,COMPLETE
58,0.811556,2021-08-15 03:45:36.781844,2021-08-15 03:46:16.525588,0 days 00:00:39.743744,3.644583736928159e-07,0.3859014654250537,0.29915960014584714,0.010002468220640675,0.964729734672951,depthwise,0.031679516727254206,9,0.024318567387356514,0.8111818436490137,1164,COMPLETE
59,0.8113576666666668,2021-08-15 03:46:16.526018,2021-08-15 03:46:22.461933,0 days 00:00:05.935915,7.11866305615937e-08,0.24531250124423737,0.3674211063936502,0.10026364258617956,0.021935436364091995,depthwise,0.3785051751393813,7,3.573679245703195,0.8446816380260583,301,COMPLETE
60,0.7168406666666667,2021-08-15 03:46:22.462363,2021-08-15 03:46:24.559390,0 days 00:00:02.097027,1.2690501345451278e-07,0.3647833954293492,0.2757991697564629,0.0031149269495054158,0.2819600785092781,depthwise,0.058258708361830704,1,8.011258650902414,0.9301105358611267,168,COMPLETE
61,0.813468,2021-08-15 03:46:24.559840,2021-08-15 03:46:43.073726,0 days 00:00:18.513886,2.1244412731093143e-06,0.290327700986386,0.24071894655850712,0.03683986498656788,0.1802794963150884,depthwise,0.5541803786429076,8,14.189127891823102,0.7945128437726919,1235,COMPLETE
62,0.8135093333333333,2021-08-15 03:46:43.074168,2021-08-15 03:46:56.786870,0 days 00:00:13.712702,5.762397833993182e-06,0.27490749723670665,0.2484983070176898,0.04163975370379586,0.4860108985766482,depthwise,0.4908934045676916,9,14.91528750357744,0.866438305065615,922,COMPLETE
63,0.8136553333333333,2021-08-15 03:46:56.787312,2021-08-15 03:47:03.547483,0 days 00:00:06.760171,2.892302190027961e-06,0.31334672733273555,0.3280448914121816,0.07526247202127466,0.43323142580253315,depthwise,0.12295909299324727,9,15.408880083169418,0.8904244736900123,291,COMPLETE
64,0.8145333333333333,2021-08-15 03:47:03.548002,2021-08-15 03:47:48.306075,0 days 00:00:44.758073,5.9364429972208355e-06,0.2004783409635323,0.3216111015451269,0.011648385085579478,0.09458148770224957,depthwise,0.13332964463189323,9,16.018128928022012,0.8748363772593123,2563,COMPLETE
65,0.8146743333333334,2021-08-15 03:47:48.306521,2021-08-15 03:48:36.686101,0 days 00:00:48.379580,8.501855605405465e-06,0.20848552660053393,0.3285009027861987,0.010876543239557205,0.0010847899048486652,depthwise,0.006065364353706885,9,19.986375102751513,0.8839245476422763,2755,COMPLETE
66,0.8148083333333332,2021-08-15 03:48:36.686538,2021-08-15 03:49:26.124879,0 days 00:00:49.438341,7.763229578691842e-06,0.20148847960860886,0.40272703704365465,0.01005422093469129,0.0007576399307181056,depthwise,0.0058305757381246345,9,19.83819762357912,0.8875167932050109,2680,COMPLETE
67,0.814888,2021-08-15 03:49:26.125330,2021-08-15 03:50:16.824049,0 days 00:00:50.698719,1.9052265151013785e-05,0.20431360441095692,0.40171087294871183,0.01006838826817251,0.001857285603944072,depthwise,0.019055234654688582,9,18.969464725312122,0.9313491138943552,2718,COMPLETE
68,0.8147046666666666,2021-08-15 03:50:16.824484,2021-08-15 03:51:04.408641,0 days 00:00:47.584157,1.2211214271907228e-05,0.20328654446616207,0.46097944036968325,0.009466269947516105,0.0006783114906215112,depthwise,0.005662518284495814,9,9.562770456243099,0.9357988556331449,2106,COMPLETE
69,0.814886,2021-08-15 03:51:04.409078,2021-08-15 03:52:03.302052,0 days 00:00:58.892974,1.0965866841471247e-05,0.2022399176389354,0.4583496415088366,0.007173412477706688,0.0006279616023133978,depthwise,0.004339384447722253,9,19.379728837673795,0.9356116516734981,3013,COMPLETE
70,0.8113253333333333,2021-08-15 03:52:03.302503,2021-08-15 03:55:50.440667,0 days 00:03:47.138164,1.731383308195696e-05,0.20057831905040138,0.4785874603130114,0.0007567033603181182,0.0006209874746822172,depthwise,0.003584063324622337,9,18.253386001089375,0.933439212552804,10000,COMPLETE
71,0.8150003333333333,2021-08-15 03:55:50.441119,2021-08-15 03:57:05.817472,0 days 00:01:15.376353,8.911634202806131e-05,0.2252558617626318,0.406480374648989,0.006256172002341108,0.00181971084093894,depthwise,0.00520293354401928,9,19.682170941028254,0.9762263398953983,3931,COMPLETE
72,0.814933,2021-08-15 03:57:05.817911,2021-08-15 03:58:06.111370,0 days 00:01:00.293459,1.1048657286455481e-05,0.22654996041578015,0.5702782218206355,0.0071919845415742995,0.0012131180276326423,depthwise,0.0015479920932518541,9,19.14545426779024,0.9900219069047653,2926,COMPLETE
73,0.8150153333333333,2021-08-15 03:58:06.111891,2021-08-15 03:59:00.261380,0 days 00:00:54.149489,0.0001145045042802741,0.22596290165245228,0.4347375831653653,0.008457466683265675,0.0014880020333489152,depthwise,0.00661823118975379,9,19.81486306669548,0.9954400329617692,2718,COMPLETE
74,0.8148823333333333,2021-08-15 03:59:00.261825,2021-08-15 04:00:06.686136,0 days 00:01:06.424311,0.0001742715109546857,0.22751655944985852,0.5515264800206144,0.006525692744962083,0.001570560057468256,depthwise,0.005404315085166867,9,19.416092021952903,0.9744200786239335,3247,COMPLETE
75,0.8142996666666668,2021-08-15 04:00:06.686576,2021-08-15 04:01:23.859716,0 days 00:01:17.173140,0.00011570274552636322,0.23081330444008166,0.5725169064781228,0.005194861544322676,0.0004805773010704132,depthwise,0.002019155863193251,9,7.483918886823516,0.9935452180672443,3047,COMPLETE
