number,value,datetime_start,datetime_complete,duration,params_alpha,params_colsample_bylevel,params_colsample_bytree,params_eta,params_gamma,params_grow_policy,params_lambda,params_max_depth,params_min_child_weight,params_subsample,user_attrs_n_estimators,state
75,0.8129210000000001,2021-08-15 20:54:17.167753,2021-08-15 20:54:52.428869,0 days 00:00:35.261116,4.405086200757533e-06,0.24309239281109285,0.7851966993582434,0.009364384514316265,2.567562181056972e-08,lossguide,0.07403121234238856,7,0.5282134370002642,0.9043935707611057,1849,COMPLETE
76,0.8131063333333334,2021-08-15 20:54:52.429314,2021-08-15 20:55:59.848758,0 days 00:01:07.419444,4.304511224644409e-06,0.2551871955470997,0.830523326196476,0.004785373669535166,1.1193539354262249e-08,lossguide,0.07384016934788527,7,0.908174678599281,0.8864698633057203,3669,COMPLETE
77,0.7814706666666668,2021-08-15 20:55:59.849268,2021-08-15 20:56:02.867567,0 days 00:00:03.018299,2.929331320998855e-06,0.25257811408721914,0.7680490232454308,0.00048008679744370407,1.0511637634115429e-08,lossguide,0.8210755320445556,7,1.326431324258982,0.8936152270250914,58,COMPLETE
78,0.8130890000000001,2021-08-15 20:56:02.868010,2021-08-15 20:58:55.448722,0 days 00:02:52.580712,5.693387881075991e-06,0.23770073598614477,0.8357545718060896,0.0018751388537820012,2.548595316083508e-08,lossguide,0.1914615785928695,7,0.8689888325297103,0.9248073497890716,9582,COMPLETE
79,0.813435,2021-08-15 20:58:55.449229,2021-08-15 21:00:14.806661,0 days 00:01:19.357432,4.914110525518725e-06,0.24905491575517752,0.8344652912937741,0.004319827284170967,2.3791121075971947e-08,lossguide,0.2344761835446697,8,1.953611144415695,0.9253188993551807,3191,COMPLETE
80,0.8134886666666666,2021-08-15 21:00:14.807107,2021-08-15 21:01:33.178547,0 days 00:01:18.371440,4.456576566860641e-06,0.2410817281059217,0.8534093244136757,0.004411090878700839,2.483924724522735e-08,lossguide,0.20504150372795532,8,2.1511126973536436,0.920678734373528,3190,COMPLETE
81,0.813492,2021-08-15 21:01:33.178999,2021-08-15 21:03:01.785961,0 days 00:01:28.606962,4.303812245897893e-06,0.24320680987962262,0.8488894481514914,0.003883810522375346,2.35610097896603e-08,lossguide,0.17672736402273878,8,2.087757249347986,0.9360421813908929,3591,COMPLETE
